OCUPAÇÃO,REF-ALT,CNAE,DESCRIÇÃO SUBCLASSE CNAE,ISS,ICMS
TRANSPORTADOR(A) MUNICIPAL DE CARGAS NÃO PERIGOSAS(CARRETO),,01/02/4930,"TRANSPORTE RODOVIÁRIO DE CARGA, EXCETO PRODUTOS PERIGOSOS E MUDANÇAS, MUNICIPAL",S,N
TRANSPORTADOR(A) MUNICIPAL DE PASSAGEIROS SOB FRETE,,01/09/4929,"TRANSPORTE RODOVIÁRIO COLETIVO DE PASSAGEIROS, SOB REGIME DE FRETAMENTO, MUNICIPAL",S,N
TRANSPORTADOR(A) MUNICIPAL DE TRAVESSIA POR NAVEGAÇÃO,,01/02/5091,"TRANSPORTE POR NAVEGAÇÃO DE TRAVESSIA, MUNICIPAL",S,N
TRANSPORTADOR(A) MUNICIPAL HIDROVIÁRIO DE CARGAS,,01/01/5021,"TRANSPORTE POR NAVEGAÇÃO INTERIOR DE CARGA, MUNICIPAL, EXCETO TRAVESSIA",S,N
TRICOTEIRO(A),,1422-3/00,"FABRICAÇÃO DE ARTIGOS DO VESTUÁRIO, PRODUZIDOS EM MALHARIAS E TRICOTAGENS, EXCETO MEIAS",N,S
VASSOUREIRO(A),,3291-4/00,"FABRICAÇÃO DE ESCOVAS, PINCÉIS E VASSOURAS",N,S
VENDEDOR(A) AMBULANTE DE PRODUTOS ALIMENTÍCIOS,,5612-1/00,SERVIÇOS AMBULANTES DE ALIMENTAÇÃO,N,S
"VENDEDOR(A) DE AVES VIVAS, COELHOS E OUTROS PEQUENOS ANIMAIS PARA ALIMENTAÇÃO",,4724-5/00,COMÉRCIO VAREJISTA DE HORTIFRUTIGRANJEIROS,N,S
VERDUREIRO,,4724-5/00,COMÉRCIO VAREJISTA DE HORTIFRUTIGRANJEIROS,N,S
VIDRACEIRO DE AUTOMÓVEIS,,4520-0/01,SERVIÇOS DE MANUTENÇÃO E REPARAÇÃO MECÂNICA DE VEÍCULOS AUTOMOTORES,S,N
VIDRACEIRO DE EDIFICAÇÕES,,4330-4/99,OUTRAS OBRAS DE ACABAMENTO DA CONSTRUÇÃO,S,N
VIGILANTE INDEPENDENTE ,(Incluído pela Resolução CGSN nº 117/2014),01/01/8011,ATIVIDADES DE VIGILÂNCIA E SEGURANÇA PRIVADA,S,N
VINAGREIRO,,01/06/1099,FABRICAÇÃO DE VINAGRES,N,S
